Bo Yu
byu1@stevens.edu

CS615 Homework4

1. OS Instances

I launched two instances for this homework. The one for DNS server and one for the client.
Then open firewall rules between the server and client allow for all the required traffic.

2. DNS Server Setup

2.1
I setup a caching only DNS server (a resolver) on my OS instance.

The necessary steps are shown below.

	- Install the following software under DNS server.
		
		[root@ip-10-28-31-11 ~]# rpm -qa | grep '^bind'
		bind-libs-9.5.0-29.P2.fc8
		bind-chroot-9.5.0-29.P2.fc8
		bind-utils-9.5.0-29.P2.fc8
		bind-9.5.0-29.P2.fc8

	- Using caching-nameserver

		open the /etc/resolv.conf and adding the following line

			nameserver 127.0.0.1

		Comments all other lines, so finally the file looks like

			; generated by /sbin/dhclient-script
			;
			;search ec2.internal
			;nameserver 172.16.0.23
			nameserver 127.0.0.1	

		Now your system will use your own nameserver (in caching mode) for resolving all domain names.	

	- Configure /etc/named.conf

		There is a very important filed: allow_query.
		
		[root@ip-10-28-98-4 ~]# cat /etc/named.conf
		//
		// named.caching-nameserver.conf
		//
		// Provided by Red Hat caching-nameserver package to configure the
		// ISC BIND named(8) DNS server as a caching only nameserver 
		// (as a localhost DNS resolver only).
		//
		// See /usr/share/doc/bind*/sample/ for example named configuration files.
		//
		// DO NOT EDIT THIS FILE - use system-config-bind or an editor
		// to create named.conf - edits to this file will be lost on 
		// caching-nameserver package upgrade.
		//

		options {
			//listen-on port 53 { 127.0.0.1; };
			//listen-on port 53 { any; };
			listen-on-v6 port 53 { ::1; };
			directory 	"/var/named";
			dump-file 	"/var/named/data/cache_dump.db";
		        statistics-file "/var/named/data/named_stats.txt";
		        memstatistics-file "/var/named/data/named_mem_stats.txt";
			//allow-query     { localhost; };
			allow-query     { any; };
			recursion yes;
		};

		logging {
		        channel default_debug {
		                file "data/named.run";
		                severity dynamic;
		        };
		};

		zone "." IN {
			type hint;
			file "named.ca";
		};

		include "/etc/named.rfc1912.zones";

	- stop iptable service to prevent ip packets are blocked.
		
		service iptables stop
	
	- Start named service.
	
		[root@ip-10-28-31-11 ~]# /etc/init.d/named start
		Starting named:                                            [  OK  ]
	
	- Check opened ports of named service.
	
		[root@ip-10-28-31-11 ~]# netstat -utlnp | grep named
		tcp        0      0 127.0.0.1:53                0.0.0.0:*                   LISTEN      32240/named         
		tcp        0      0 127.0.0.1:953               0.0.0.0:*                   LISTEN      32240/named         
		tcp        0      0 ::1:53                      :::*                        LISTEN      32240/named         
		tcp        0      0 ::1:953                     :::*                        LISTEN      32240/named         
		udp        0      0 0.0.0.0:32779               0.0.0.0:*                               32240/named         
		udp        0      0 127.0.0.1:53                0.0.0.0:*                               32240/named         
		udp        0      0 :::32780                    :::*                                    32240/named         
		udp        0      0 ::1:53                      :::*                                    32240/named
		
	- Check named log information.
	
		[root@ip-10-28-31-11 ~]# tail -n 30 /var/log/messages | grep named
		Mar 25 14:08:06 ip-10-28-31-11 named[32240]: starting BIND 9.5.0-P2 -u named -t /var/named/chroot
		Mar 25 14:08:06 ip-10-28-31-11 named[32240]: found 1 CPU, using 1 worker thread
		Mar 25 14:08:06 ip-10-28-31-11 named[32240]: loading configuration from '/etc/named.conf'
		[.....]
		
	- Test 
	
		[root@ip-10-28-31-11 ~]# dig www.google.com @127.0.0.1

		; <<>> DiG 9.5.0-P2 <<>> www.google.com @127.0.0.1
		;; global options:  printcmd
		;; Got answer:
		;; ->>HEADER<<- opcode: QUERY, status: NOERROR, id: 52014
		;; flags: qr rd ra; QUERY: 1, ANSWER: 7, AUTHORITY: 4, ADDITIONAL: 0

		;; QUESTION SECTION:
		;www.google.com.			IN	A

		;; ANSWER SECTION:
		www.google.com.		604800	IN	CNAME	www.l.google.com.
		www.l.google.com.	300	IN	A	173.194.73.106
		www.l.google.com.	300	IN	A	173.194.73.147
		www.l.google.com.	300	IN	A	173.194.73.99
		www.l.google.com.	300	IN	A	173.194.73.103
		www.l.google.com.	300	IN	A	173.194.73.104
		www.l.google.com.	300	IN	A	173.194.73.105

		;; AUTHORITY SECTION:
		google.com.		172799	IN	NS	ns2.google.com.
		google.com.		172799	IN	NS	ns4.google.com.
		google.com.		172799	IN	NS	ns3.google.com.
		google.com.		172799	IN	NS	ns1.google.com.

		;; Query time: 177 msec
		;; SERVER: 127.0.0.1#53(127.0.0.1)
		;; WHEN: Sun Mar 25 14:15:33 2012
		;; MSG SIZE  rcvd: 220

2.2	
I also setup a client host to use newly created DNS server for host lookups.

The necessary steps are shown below.
		
	- Using the new DNS server we just created as lookup DNS
	
		Modified /etc/resolv.conf to specify DNS server.

		[root@domU-12-31-39-14-F9-3A ~]# cat /etc/resolv.conf 
		; generated by /sbin/dhclient-script
		;search us-west-1.compute.internal
		;nameserver 172.16.0.23
		nameserver 107.20.56.87
		
	- To test the client, we can use host, nslookup, dig.
	
		-- Using host to display dns server information.
	
			[root@domU-12-31-39-14-F9-3A ~]# host 107.20.56.87
			87.56.20.107.in-addr.arpa domain name pointer ec2-107-20-56-87.compute-1.amazonaws.com.
		
		-- Using nslookup to display IP of a hostname.
		
			[root@domU-12-31-39-14-F9-3A ~]# nslookup ec2-107-20-56-87.compute-1.amazonaws.com
			Server:		107.20.56.87
			Address:	107.20.56.87#53

			Non-authoritative answer:
			Name:	ec2-107-20-56-87.compute-1.amazonaws.com
			Address: 107.20.56.87
			
		-- Using dig to trace DNS queries.
		
			[root@domU-12-31-39-14-F9-3A ~]# dig +trace ec2-107-20-56-87.compute-1.amazonaws.com

			; <<>> DiG 9.5.0-P2 <<>> +trace ec2-107-20-56-87.compute-1.amazonaws.com
			;; global options:  printcmd
			.			515983	IN	NS	d.root-servers.net.
			.			515983	IN	NS	j.root-servers.net.
			.			515983	IN	NS	b.root-servers.net.
			.			515983	IN	NS	f.root-servers.net.
			.			515983	IN	NS	h.root-servers.net.
			.			515983	IN	NS	k.root-servers.net.
			.			515983	IN	NS	g.root-servers.net.
			.			515983	IN	NS	c.root-servers.net.
			.			515983	IN	NS	a.root-servers.net.
			.			515983	IN	NS	m.root-servers.net.
			.			515983	IN	NS	e.root-servers.net.
			.			515983	IN	NS	l.root-servers.net.
			.			515983	IN	NS	i.root-servers.net.
			;; Received 512 bytes from 107.20.56.87#53(107.20.56.87) in 2 ms

			com.			172800	IN	NS	i.gtld-servers.net.
			com.			172800	IN	NS	f.gtld-servers.net.
			com.			172800	IN	NS	k.gtld-servers.net.
			com.			172800	IN	NS	a.gtld-servers.net.
			com.			172800	IN	NS	c.gtld-servers.net.
			com.			172800	IN	NS	m.gtld-servers.net.
			com.			172800	IN	NS	l.gtld-servers.net.
			com.			172800	IN	NS	h.gtld-servers.net.
			com.			172800	IN	NS	b.gtld-servers.net.
			com.			172800	IN	NS	e.gtld-servers.net.
			com.			172800	IN	NS	j.gtld-servers.net.
			com.			172800	IN	NS	g.gtld-servers.net.
			com.			172800	IN	NS	d.gtld-servers.net.
			;; Received 490 bytes from 192.112.36.4#53(g.root-servers.net) in 254 ms

			amazonaws.com.		172800	IN	NS	pdns3.ultradns.org.
			amazonaws.com.		172800	IN	NS	pdns1.ultradns.net.
			amazonaws.com.		172800	IN	NS	pdns5.ultradns.info.
			amazonaws.com.		172800	IN	NS	u1.amazonaws.com.
			amazonaws.com.		172800	IN	NS	u2.amazonaws.com.
			amazonaws.com.		172800	IN	NS	u4.amazonaws.com.
			amazonaws.com.		172800	IN	NS	u6.amazonaws.com.
			amazonaws.com.		172800	IN	NS	u3.amazonaws.com.
			amazonaws.com.		172800	IN	NS	u5.amazonaws.com.
			;; Received 369 bytes from 192.42.93.30#53(g.gtld-servers.net) in 64 ms

			ec2-107-20-56-87.compute-1.amazonaws.com. 300 IN A 107.20.56.87
			compute-1.amazonaws.com. 86400	IN	NS	pdns1.ultradns.net.
			compute-1.amazonaws.com. 86400	IN	NS	pdns3.ultradns.org.
			compute-1.amazonaws.com. 86400	IN	NS	pdns5.ultradns.info.
			compute-1.amazonaws.com. 86400	IN	NS	u1.amazonaws.com.
			compute-1.amazonaws.com. 86400	IN	NS	u2.amazonaws.com.
			compute-1.amazonaws.com. 86400	IN	NS	u3.amazonaws.com.
			compute-1.amazonaws.com. 86400	IN	NS	u4.amazonaws.com.
			compute-1.amazonaws.com. 86400	IN	NS	u5.amazonaws.com.
			compute-1.amazonaws.com. 86400	IN	NS	u6.amazonaws.com.
			;; Received 273 bytes from 156.154.67.10#53(u4.amazonaws.com) in 3 ms


3. tcpdump exercises

	Use the tcpdump utility to monitor the network traffic using the following scenarios:

	3.1
	on the DNS server, run the following commands:
		telnet www.yahoo.com 80
		GET / HTTP/1.0

	3.1.1
	Track down the packets in your tcpdump referring to the DNS query from your DNS server to one of the root servers, then to the various DNS servers 				
	before the DNS information is returned to your server by one of Yahoo!'s authoritative DNS servers.
	
	[Solution]
	
	- Open a login session for the DNS server, run the following command to monitor the DNS query
	
		[root@ip-10-28-98-4 ~]# tcpdump udp port 53
		tcpdump: verbose output suppressed, use -v or -vv for full protocol decode
		listening on eth0, link-type EN10MB (Ethernet), capture size 96 bytes
	
	- Open a second login session for the DNS server, and run the following command to login www.yahoo.com
	
		[root@ip-10-28-98-4 ~]# telnet www.yahoo.com 80
		Trying 98.139.183.24...
		Connected to www.yahoo.com.
		Escape character is '^]'.
	
	- In the first session, you can capture the following packets
	
	 	[root@ip-10-28-98-4 hw4]# tcpdump udp port 53
		tcpdump: verbose output suppressed, use -v or -vv for full protocol decode
		listening on eth0, link-type EN10MB (Ethernet), capture size 96 bytes
		16:58:30.668868 IP 10.28.98.4.29501 > ns1.yahoo.com.domain: 3673 [1au] AAAA? www.yahoo.com. (42)
		16:58:30.670840 IP ns1.yahoo.com.domain > 10.28.98.4.29501: 3673*- 1/8/9 CNAME[|domain]
		16:58:30.671588 IP 10.28.98.4.37693 > yf2.yahoo.com.domain: 51688 [1au] AAAA? fp3.wg1.b.yahoo.com. (48)
		16:58:30.673338 IP yf2.yahoo.com.domain > 10.28.98.4.37693: 51688*- 0/1/0 (102)
		16:58:30.681996 IP 10.28.98.4.61786 > yf1.yahoo.com.domain: 5972 [1au] AAAA? fp3.wg1.b.yahoo.com. (48)
		16:58:30.683996 IP yf1.yahoo.com.domain > 10.28.98.4.61786: 5972*- 0/1/0 (102)
		16:58:30.684237 IP 10.28.98.4.41073 > yf8.yahoo.com.domain: 28459 [1au] AAAA? fp3.wg1.b.yahoo.com. (48)
		16:58:30.909204 IP yf8.yahoo.com.domain > 10.28.98.4.41073: 28459*- 1/13/0 CNAME[|domain]
		16:58:30.909778 IP 10.28.98.4.24672 > yf2.yahoo.com.domain: 26104 [1au] AAAA? any-fp3-lfb.wa1.b.yahoo.com. (56)
		16:58:30.911762 IP yf2.yahoo.com.domain > 10.28.98.4.24672: 26104*- 0/1/0 (106)
		16:58:30.912277 IP 10.28.98.4.41414 > yf1.yahoo.com.domain: 6302 [1au] A? any-fp3-lfb.wa1.b.yahoo.com. (56)
		16:58:30.914220 IP yf1.yahoo.com.domain > 10.28.98.4.41414: 6302*- 3/0/0[|domain]
		16:58:30.914507 IP 10.28.98.4.59089 > yf2.yahoo.com.domain: 49289 [1au] A? any-fp3-real.wa1.b.yahoo.com. (57)
		16:58:30.916282 IP yf2.yahoo.com.domain > 10.28.98.4.59089: 49289*- 1/0/0 (62)
	
	3.1.2
	Identify the 3-way handshake that initiates the connection from your DNS server to port 80 on Yahoo!'s webserver, the packets that are being sent back 
	and forth and finally the closing of the connection.

	[Solution]
	
	- When I try to get content from yahoo by typing GET / HTTP/1.0, the tcpdump captured the following packets.
	
		[root@ip-10-28-98-4 hw4]# tcpdump tcp port 80
		tcpdump: verbose output suppressed, use -v or -vv for full protocol decode
		listening on eth0, link-type EN10MB (Ethernet), capture size 96 bytes
		16:58:30.916654 IP 10.28.98.4.51573 > ir2.fp.vip.bf1.yahoo.com.http: S 3400251960:3400251960(0) win 5840 <mss 1460,sackOK,timestamp 2888091 
		0,nop,wscale 6>
		16:58:30.948359 IP ir2.fp.vip.bf1.yahoo.com.http > 10.28.98.4.51573: S 1781654617:1781654617(0) ack 3400251961 win 8192 <mss 
		1460,nop,nop,sackOK,nop,wscale 8>
		16:58:30.948379 IP 10.28.98.4.51573 > ir2.fp.vip.bf1.yahoo.com.http: . ack 1 win 92
		16:59:45.773858 IP 10.28.98.4.51573 > ir2.fp.vip.bf1.yahoo.com.http: P 1:17(16) ack 1 win 92
		16:59:45.805105 IP ir2.fp.vip.bf1.yahoo.com.http > 10.28.98.4.51573: . ack 17 win 23
		16:59:47.104131 IP 10.28.98.4.51573 > ir2.fp.vip.bf1.yahoo.com.http: P 17:19(2) ack 1 win 92
		16:59:47.135384 IP ir2.fp.vip.bf1.yahoo.com.http > 10.28.98.4.51573: . ack 19 win 23
		16:59:47.387598 IP ir2.fp.vip.bf1.yahoo.com.http > 10.28.98.4.51573: . 1:1461(1460) ack 19 win 23
		16:59:47.387611 IP 10.28.98.4.51573 > ir2.fp.vip.bf1.yahoo.com.http: . ack 1461 win 137
		16:59:47.389275 IP ir2.fp.vip.bf1.yahoo.com.http > 10.28.98.4.51573: . 1461:2921(1460) ack 19 win 23
		16:59:47.389283 IP 10.28.98.4.51573 > ir2.fp.vip.bf1.yahoo.com.http: . ack 2921 win 183
		16:59:47.419336 IP ir2.fp.vip.bf1.yahoo.com.http > 10.28.98.4.51573: . 2921:4381(1460) ack 19 win 23
		16:59:47.419349 IP 10.28.98.4.51573 > ir2.fp.vip.bf1.yahoo.com.http: . ack 4381 win 229
		16:59:47.420871 IP ir2.fp.vip.bf1.yahoo.com.http > 10.28.98.4.51573: . 4381:5841(1460) ack 19 win 23
		16:59:47.420880 IP 10.28.98.4.51573 > ir2.fp.vip.bf1.yahoo.com.http: . ack 5841 win 274
		16:59:47.420885 IP ir2.fp.vip.bf1.yahoo.com.http > 10.28.98.4.51573: . 5841:7301(1460) ack 19 win 23
		16:59:47.420889 IP 10.28.98.4.51573 > ir2.fp.vip.bf1.yahoo.com.http: . ack 7301 win 320
		16:59:47.420902 IP ir2.fp.vip.bf1.yahoo.com.http > 10.28.98.4.51573: . 7301:8761(1460) ack 19 win 23
		16:59:47.420909 IP 10.28.98.4.51573 > ir2.fp.vip.bf1.yahoo.com.http: . ack 8761 win 365
		16:59:47.450576 IP ir2.fp.vip.bf1.yahoo.com.http > 10.28.98.4.51573: . 8761:10221(1460) ack 19 win 23
		16:59:47.450587 IP 10.28.98.4.51573 > ir2.fp.vip.bf1.yahoo.com.http: . ack 10221 win 411
		16:59:47.452118 IP ir2.fp.vip.bf1.yahoo.com.http > 10.28.98.4.51573: P 10221:11681(1460) ack 19 win 23
		16:59:47.452128 IP 10.28.98.4.51573 > ir2.fp.vip.bf1.yahoo.com.http: . ack 11681 win 457
		16:59:47.452133 IP ir2.fp.vip.bf1.yahoo.com.http > 10.28.98.4.51573: . 11681:13141(1460) ack 19 win 23
		16:59:47.452137 IP 10.28.98.4.51573 > ir2.fp.vip.bf1.yahoo.com.http: . ack 13141 win 502
		16:59:47.452356 IP ir2.fp.vip.bf1.yahoo.com.http > 10.28.98.4.51573: . 13141:14601(1460) ack 19 win 23
		16:59:47.452364 IP 10.28.98.4.51573 > ir2.fp.vip.bf1.yahoo.com.http: . ack 14601 win 548
		16:59:47.453282 IP ir2.fp.vip.bf1.yahoo.com.http > 10.28.98.4.51573: . 14601:16061(1460) ack 19 win 23
		16:59:47.453292 IP 10.28.98.4.51573 > ir2.fp.vip.bf1.yahoo.com.http: . ack 16061 win 594
		16:59:47.453297 IP ir2.fp.vip.bf1.yahoo.com.http > 10.28.98.4.51573: . 16061:17521(1460) ack 19 win 23
		16:59:47.453301 IP 10.28.98.4.51573 > ir2.fp.vip.bf1.yahoo.com.http: . ack 17521 win 639
		16:59:47.482068 IP ir2.fp.vip.bf1.yahoo.com.http > 10.28.98.4.51573: . 17521:18981(1460) ack 19 win 23
		16:59:47.482079 IP 10.28.98.4.51573 > ir2.fp.vip.bf1.yahoo.com.http: . ack 18981 win 685
		16:59:47.483850 IP ir2.fp.vip.bf1.yahoo.com.http > 10.28.98.4.51573: P 18981:20441(1460) ack 19 win 23
		16:59:47.483860 IP 10.28.98.4.51573 > ir2.fp.vip.bf1.yahoo.com.http: . ack 20441 win 730
		16:59:47.483865 IP ir2.fp.vip.bf1.yahoo.com.http > 10.28.98.4.51573: . 20441:21901(1460) ack 19 win 23
		16:59:47.483869 IP 10.28.98.4.51573 > ir2.fp.vip.bf1.yahoo.com.http: . ack 21901 win 776
		16:59:47.483882 IP ir2.fp.vip.bf1.yahoo.com.http > 10.28.98.4.51573: . 21901:23361(1460) ack 19 win 23
		16:59:47.483887 IP 10.28.98.4.51573 > ir2.fp.vip.bf1.yahoo.com.http: . ack 23361 win 822
		16:59:47.483909 IP ir2.fp.vip.bf1.yahoo.com.http > 10.28.98.4.51573: . 23361:24821(1460) ack 19 win 23
		16:59:47.483914 IP 10.28.98.4.51573 > ir2.fp.vip.bf1.yahoo.com.http: . ack 24821 win 867
		16:59:47.484384 IP ir2.fp.vip.bf1.yahoo.com.http > 10.28.98.4.51573: . 24821:26281(1460) ack 19 win 23
		16:59:47.484394 IP 10.28.98.4.51573 > ir2.fp.vip.bf1.yahoo.com.http: . ack 26281 win 913
		16:59:47.484399 IP ir2.fp.vip.bf1.yahoo.com.http > 10.28.98.4.51573: . 26281:27741(1460) ack 19 win 23
		16:59:47.484402 IP 10.28.98.4.51573 > ir2.fp.vip.bf1.yahoo.com.http: . ack 27741 win 959
		16:59:47.484404 IP ir2.fp.vip.bf1.yahoo.com.http > 10.28.98.4.51573: . 27741:29201(1460) ack 19 win 23
		16:59:47.484408 IP 10.28.98.4.51573 > ir2.fp.vip.bf1.yahoo.com.http: . ack 29201 win 961
		16:59:47.484410 IP ir2.fp.vip.bf1.yahoo.com.http > 10.28.98.4.51573: . 29201:30661(1460) ack 19 win 23
		16:59:47.484414 IP 10.28.98.4.51573 > ir2.fp.vip.bf1.yahoo.com.http: . ack 30661 win 939
		16:59:47.484639 IP ir2.fp.vip.bf1.yahoo.com.http > 10.28.98.4.51573: P 30661:32121(1460) ack 19 win 23
		16:59:47.484647 IP 10.28.98.4.51573 > ir2.fp.vip.bf1.yahoo.com.http: . ack 32121 win 1002
		16:59:47.513576 IP ir2.fp.vip.bf1.yahoo.com.http > 10.28.98.4.51573: . 32121:33581(1460) ack 19 win 23
		16:59:47.514263 IP ir2.fp.vip.bf1.yahoo.com.http > 10.28.98.4.51573: . 33581:35041(1460) ack 19 win 23
		16:59:47.514272 IP 10.28.98.4.51573 > ir2.fp.vip.bf1.yahoo.com.http: . ack 35041 win 1002
		16:59:47.515347 IP ir2.fp.vip.bf1.yahoo.com.http > 10.28.98.4.51573: . 35041:36501(1460) ack 19 win 23
		16:59:47.515386 IP ir2.fp.vip.bf1.yahoo.com.http > 10.28.98.4.51573: . 36501:37961(1460) ack 19 win 23
		16:59:47.515423 IP 10.28.98.4.51573 > ir2.fp.vip.bf1.yahoo.com.http: . ack 37961 win 1002
		16:59:47.515613 IP ir2.fp.vip.bf1.yahoo.com.http > 10.28.98.4.51573: . 37961:39421(1460) ack 19 win 23
		16:59:47.515620 IP ir2.fp.vip.bf1.yahoo.com.http > 10.28.98.4.51573: P 39421:40881(1460) ack 19 win 23
		16:59:47.515623 IP ir2.fp.vip.bf1.yahoo.com.http > 10.28.98.4.51573: . 40881:42341(1460) ack 19 win 23
		16:59:47.515626 IP ir2.fp.vip.bf1.yahoo.com.http > 10.28.98.4.51573: . 42341:43801(1460) ack 19 win 23
		16:59:47.515644 IP ir2.fp.vip.bf1.yahoo.com.http > 10.28.98.4.51573: . 43801:45261(1460) ack 19 win 23
		16:59:47.515673 IP ir2.fp.vip.bf1.yahoo.com.http > 10.28.98.4.51573: . 45261:46721(1460) ack 19 win 23
		16:59:47.515717 IP ir2.fp.vip.bf1.yahoo.com.http > 10.28.98.4.51573: . 46721:48181(1460) ack 19 win 23
		16:59:47.515764 IP 10.28.98.4.51573 > ir2.fp.vip.bf1.yahoo.com.http: . ack 48181 win 982
		16:59:47.515908 IP ir2.fp.vip.bf1.yahoo.com.http > 10.28.98.4.51573: P 48181:49641(1460) ack 19 win 23
		16:59:47.515913 IP ir2.fp.vip.bf1.yahoo.com.http > 10.28.98.4.51573: . 49641:51101(1460) ack 19 win 23
		16:59:47.515915 IP ir2.fp.vip.bf1.yahoo.com.http > 10.28.98.4.51573: . 51101:52561(1460) ack 19 win 23
		16:59:47.515917 IP ir2.fp.vip.bf1.yahoo.com.http > 10.28.98.4.51573: . 52561:54021(1460) ack 19 win 23
		16:59:47.515937 IP ir2.fp.vip.bf1.yahoo.com.http > 10.28.98.4.51573: . 54021:55481(1460) ack 19 win 23
		16:59:47.515978 IP 10.28.98.4.51573 > ir2.fp.vip.bf1.yahoo.com.http: . ack 55481 win 1002
		16:59:47.516948 IP ir2.fp.vip.bf1.yahoo.com.http > 10.28.98.4.51573: . 55481:56941(1460) ack 19 win 23
		16:59:47.516956 IP ir2.fp.vip.bf1.yahoo.com.http > 10.28.98.4.51573: P 56941:58401(1460) ack 19 win 23
		16:59:47.517025 IP 10.28.98.4.51573 > ir2.fp.vip.bf1.yahoo.com.http: . ack 58401 win 1002
		16:59:47.546075 IP ir2.fp.vip.bf1.yahoo.com.http > 10.28.98.4.51573: . 58401:59861(1460) ack 19 win 23
		16:59:47.546639 IP ir2.fp.vip.bf1.yahoo.com.http > 10.28.98.4.51573: . 59861:61321(1460) ack 19 win 23
		16:59:47.546648 IP 10.28.98.4.51573 > ir2.fp.vip.bf1.yahoo.com.http: . ack 61321 win 1047
		16:59:47.546653 IP ir2.fp.vip.bf1.yahoo.com.http > 10.28.98.4.51573: . 61321:62781(1460) ack 19 win 23
		16:59:47.546657 IP 10.28.98.4.51573 > ir2.fp.vip.bf1.yahoo.com.http: . ack 62781 win 1093
		16:59:47.546671 IP ir2.fp.vip.bf1.yahoo.com.http > 10.28.98.4.51573: . 62781:64241(1460) ack 19 win 23
		16:59:47.546675 IP 10.28.98.4.51573 > ir2.fp.vip.bf1.yahoo.com.http: . ack 64241 win 1139
		16:59:47.547100 IP ir2.fp.vip.bf1.yahoo.com.http > 10.28.98.4.51573: . 64241:65701(1460) ack 19 win 23
		16:59:47.547109 IP 10.28.98.4.51573 > ir2.fp.vip.bf1.yahoo.com.http: . ack 65701 win 1184
		16:59:47.547148 IP ir2.fp.vip.bf1.yahoo.com.http > 10.28.98.4.51573: P 65701:67161(1460) ack 19 win 23
		16:59:47.547155 IP 10.28.98.4.51573 > ir2.fp.vip.bf1.yahoo.com.http: . ack 67161 win 1230
		16:59:47.547202 IP ir2.fp.vip.bf1.yahoo.com.http > 10.28.98.4.51573: . 67161:68621(1460) ack 19 win 23
		16:59:47.547209 IP 10.28.98.4.51573 > ir2.fp.vip.bf1.yahoo.com.http: . ack 68621 win 1252
		16:59:47.547233 IP ir2.fp.vip.bf1.yahoo.com.http > 10.28.98.4.51573: . 68621:70081(1460) ack 19 win 23
		16:59:47.547238 IP 10.28.98.4.51573 > ir2.fp.vip.bf1.yahoo.com.http: . ack 70081 win 1278
		16:59:47.547435 IP ir2.fp.vip.bf1.yahoo.com.http > 10.28.98.4.51573: . 70081:71541(1460) ack 19 win 23
		16:59:47.547441 IP ir2.fp.vip.bf1.yahoo.com.http > 10.28.98.4.51573: . 71541:73001(1460) ack 19 win 23
		16:59:47.547444 IP ir2.fp.vip.bf1.yahoo.com.http > 10.28.98.4.51573: . 73001:74461(1460) ack 19 win 23
		16:59:47.547447 IP ir2.fp.vip.bf1.yahoo.com.http > 10.28.98.4.51573: . 74461:75921(1460) ack 19 win 23
		16:59:47.547467 IP ir2.fp.vip.bf1.yahoo.com.http > 10.28.98.4.51573: . 75921:77381(1460) ack 19 win 23
		16:59:47.547471 IP ir2.fp.vip.bf1.yahoo.com.http > 10.28.98.4.51573: . 77381:78841(1460) ack 19 win 23
		16:59:47.547689 IP 10.28.98.4.51573 > ir2.fp.vip.bf1.yahoo.com.http: . ack 78841 win 1278
		16:59:47.548207 IP ir2.fp.vip.bf1.yahoo.com.http > 10.28.98.4.51573: . 78841:80301(1460) ack 19 win 23
		16:59:47.548214 IP ir2.fp.vip.bf1.yahoo.com.http > 10.28.98.4.51573: P 80301:81761(1460) ack 19 win 23
		16:59:47.548216 IP ir2.fp.vip.bf1.yahoo.com.http > 10.28.98.4.51573: . 81761:83221(1460) ack 19 win 23
		16:59:47.548219 IP ir2.fp.vip.bf1.yahoo.com.http > 10.28.98.4.51573: . 83221:84681(1460) ack 19 win 23
		16:59:47.548250 IP 10.28.98.4.51573 > ir2.fp.vip.bf1.yahoo.com.http: . ack 84681 win 1278
		16:59:47.548386 IP ir2.fp.vip.bf1.yahoo.com.http > 10.28.98.4.51573: . 84681:86141(1460) ack 19 win 23
		16:59:47.549285 IP ir2.fp.vip.bf1.yahoo.com.http > 10.28.98.4.51573: . 86141:87601(1460) ack 19 win 23
		16:59:47.549297 IP 10.28.98.4.51573 > ir2.fp.vip.bf1.yahoo.com.http: . ack 87601 win 1278
		16:59:47.578322 IP ir2.fp.vip.bf1.yahoo.com.http > 10.28.98.4.51573: . 87601:89061(1460) ack 19 win 23
		16:59:47.578371 IP ir2.fp.vip.bf1.yahoo.com.http > 10.28.98.4.51573: . 89061:90521(1460) ack 19 win 23
		16:59:47.578387 IP 10.28.98.4.51573 > ir2.fp.vip.bf1.yahoo.com.http: . ack 90521 win 1278
		16:59:47.578420 IP ir2.fp.vip.bf1.yahoo.com.http > 10.28.98.4.51573: . 90521:91981(1460) ack 19 win 23
		16:59:47.578605 IP ir2.fp.vip.bf1.yahoo.com.http > 10.28.98.4.51573: P 91981:93441(1460) ack 19 win 23
		16:59:47.578612 IP 10.28.98.4.51573 > ir2.fp.vip.bf1.yahoo.com.http: . ack 93441 win 1278
		16:59:47.578617 IP ir2.fp.vip.bf1.yahoo.com.http > 10.28.98.4.51573: . 93441:94901(1460) ack 19 win 23
		16:59:47.578620 IP ir2.fp.vip.bf1.yahoo.com.http > 10.28.98.4.51573: . 94901:96361(1460) ack 19 win 23
		16:59:47.578623 IP ir2.fp.vip.bf1.yahoo.com.http > 10.28.98.4.51573: . 96361:97821(1460) ack 19 win 23
		16:59:47.578635 IP ir2.fp.vip.bf1.yahoo.com.http > 10.28.98.4.51573: . 97821:99281(1460) ack 19 win 23
		16:59:47.578667 IP ir2.fp.vip.bf1.yahoo.com.http > 10.28.98.4.51573: . 99281:100741(1460) ack 19 win 23
		16:59:47.578838 IP 10.28.98.4.51573 > ir2.fp.vip.bf1.yahoo.com.http: . ack 100741 win 1278
		16:59:47.578906 IP ir2.fp.vip.bf1.yahoo.com.http > 10.28.98.4.51573: . 100741:102201(1460) ack 19 win 23
		16:59:47.578911 IP ir2.fp.vip.bf1.yahoo.com.http > 10.28.98.4.51573: . 102201:103661(1460) ack 19 win 23
		16:59:47.578913 IP ir2.fp.vip.bf1.yahoo.com.http > 10.28.98.4.51573: P 103661:105121(1460) ack 19 win 23
		16:59:47.578916 IP ir2.fp.vip.bf1.yahoo.com.http > 10.28.98.4.51573: . 105121:106581(1460) ack 19 win 23
		16:59:47.578918 IP ir2.fp.vip.bf1.yahoo.com.http > 10.28.98.4.51573: . 106581:108041(1460) ack 19 win 23
		16:59:47.579056 IP 10.28.98.4.51573 > ir2.fp.vip.bf1.yahoo.com.http: . ack 108041 win 1278
		16:59:47.579148 IP ir2.fp.vip.bf1.yahoo.com.http > 10.28.98.4.51573: . 108041:109501(1460) ack 19 win 23
		16:59:47.579152 IP ir2.fp.vip.bf1.yahoo.com.http > 10.28.98.4.51573: . 109501:110961(1460) ack 19 win 23
		16:59:47.579154 IP ir2.fp.vip.bf1.yahoo.com.http > 10.28.98.4.51573: . 110961:112421(1460) ack 19 win 23
		16:59:47.579176 IP ir2.fp.vip.bf1.yahoo.com.http > 10.28.98.4.51573: . 112421:113881(1460) ack 19 win 23
		16:59:47.579250 IP 10.28.98.4.51573 > ir2.fp.vip.bf1.yahoo.com.http: . ack 113881 win 1278
		16:59:47.580128 IP ir2.fp.vip.bf1.yahoo.com.http > 10.28.98.4.51573: . 113881:115341(1460) ack 19 win 23
		16:59:47.580135 IP ir2.fp.vip.bf1.yahoo.com.http > 10.28.98.4.51573: P 115341:116801(1460) ack 19 win 23
		16:59:47.580137 IP ir2.fp.vip.bf1.yahoo.com.http > 10.28.98.4.51573: . 116801:118261(1460) ack 19 win 23
		16:59:47.580139 IP ir2.fp.vip.bf1.yahoo.com.http > 10.28.98.4.51573: . 118261:119721(1460) ack 19 win 23
		16:59:47.580162 IP 10.28.98.4.51573 > ir2.fp.vip.bf1.yahoo.com.http: . ack 119721 win 1278
		16:59:47.580632 IP ir2.fp.vip.bf1.yahoo.com.http > 10.28.98.4.51573: . 119721:121181(1460) ack 19 win 23
		16:59:47.580639 IP ir2.fp.vip.bf1.yahoo.com.http > 10.28.98.4.51573: . 121181:122641(1460) ack 19 win 23
		16:59:47.580641 IP ir2.fp.vip.bf1.yahoo.com.http > 10.28.98.4.51573: . 122641:124101(1460) ack 19 win 23
		16:59:47.580660 IP ir2.fp.vip.bf1.yahoo.com.http > 10.28.98.4.51573: P 124101:125561(1460) ack 19 win 23
		16:59:47.580710 IP 10.28.98.4.51573 > ir2.fp.vip.bf1.yahoo.com.http: . ack 125561 win 1278
		16:59:47.581289 IP ir2.fp.vip.bf1.yahoo.com.http > 10.28.98.4.51573: . 125561:127021(1460) ack 19 win 23
		16:59:47.581296 IP ir2.fp.vip.bf1.yahoo.com.http > 10.28.98.4.51573: . 127021:128481(1460) ack 19 win 23
		16:59:47.581328 IP 10.28.98.4.51573 > ir2.fp.vip.bf1.yahoo.com.http: . ack 128481 win 1278
		16:59:47.609834 IP ir2.fp.vip.bf1.yahoo.com.http > 10.28.98.4.51573: . 128481:129941(1460) ack 19 win 23
		16:59:47.610328 IP ir2.fp.vip.bf1.yahoo.com.http > 10.28.98.4.51573: P 129941:131401(1460) ack 19 win 23
		16:59:47.610337 IP 10.28.98.4.51573 > ir2.fp.vip.bf1.yahoo.com.http: . ack 131401 win 1278
		16:59:47.610342 IP ir2.fp.vip.bf1.yahoo.com.http > 10.28.98.4.51573: . 131401:132861(1460) ack 19 win 23
		16:59:47.610359 IP ir2.fp.vip.bf1.yahoo.com.http > 10.28.98.4.51573: . 132861:134321(1460) ack 19 win 23
		16:59:47.610390 IP ir2.fp.vip.bf1.yahoo.com.http > 10.28.98.4.51573: . 134321:135781(1460) ack 19 win 23
		16:59:47.610438 IP ir2.fp.vip.bf1.yahoo.com.http > 10.28.98.4.51573: . 135781:137241(1460) ack 19 win 23
		16:59:47.610457 IP 10.28.98.4.51573 > ir2.fp.vip.bf1.yahoo.com.http: . ack 137241 win 1278
		16:59:47.610635 IP ir2.fp.vip.bf1.yahoo.com.http > 10.28.98.4.51573: . 137241:138701(1460) ack 19 win 23
		16:59:47.610639 IP ir2.fp.vip.bf1.yahoo.com.http > 10.28.98.4.51573: . 138701:140161(1460) ack 19 win 23
		16:59:47.610642 IP ir2.fp.vip.bf1.yahoo.com.http > 10.28.98.4.51573: . 140161:141621(1460) ack 19 win 23
		16:59:47.610644 IP ir2.fp.vip.bf1.yahoo.com.http > 10.28.98.4.51573: P 141621:143081(1460) ack 19 win 23
		16:59:47.610664 IP ir2.fp.vip.bf1.yahoo.com.http > 10.28.98.4.51573: . 143081:144541(1460) ack 19 win 23
		16:59:47.610683 IP 10.28.98.4.51573 > ir2.fp.vip.bf1.yahoo.com.http: . ack 144541 win 1278
		16:59:47.610696 IP ir2.fp.vip.bf1.yahoo.com.http > 10.28.98.4.51573: . 144541:146001(1460) ack 19 win 23
		16:59:47.610744 IP ir2.fp.vip.bf1.yahoo.com.http > 10.28.98.4.51573: . 146001:147461(1460) ack 19 win 23
		16:59:47.610784 IP ir2.fp.vip.bf1.yahoo.com.http > 10.28.98.4.51573: . 147461:148921(1460) ack 19 win 23
		16:59:47.610814 IP ir2.fp.vip.bf1.yahoo.com.http > 10.28.98.4.51573: . 148921:150381(1460) ack 19 win 23
		16:59:47.610890 IP 10.28.98.4.51573 > ir2.fp.vip.bf1.yahoo.com.http: . ack 150381 win 1278
		16:59:47.611405 IP ir2.fp.vip.bf1.yahoo.com.http > 10.28.98.4.51573: . 150381:151841(1460) ack 19 win 23
		16:59:47.611412 IP ir2.fp.vip.bf1.yahoo.com.http > 10.28.98.4.51573: . 151841:153301(1460) ack 19 win 23
		16:59:47.611415 IP ir2.fp.vip.bf1.yahoo.com.http > 10.28.98.4.51573: . 153301:154761(1460) ack 19 win 23
		16:59:47.611417 IP ir2.fp.vip.bf1.yahoo.com.http > 10.28.98.4.51573: . 154761:156221(1460) ack 19 win 23
		16:59:47.611419 IP ir2.fp.vip.bf1.yahoo.com.http > 10.28.98.4.51573: . 156221:157681(1460) ack 19 win 23
		16:59:47.611422 IP ir2.fp.vip.bf1.yahoo.com.http > 10.28.98.4.51573: . 157681:159141(1460) ack 19 win 23
		16:59:47.611424 IP ir2.fp.vip.bf1.yahoo.com.http > 10.28.98.4.51573: P 159141:160601(1460) ack 19 win 23
		16:59:47.611426 IP ir2.fp.vip.bf1.yahoo.com.http > 10.28.98.4.51573: . 160601:162061(1460) ack 19 win 23
		16:59:47.611432 IP ir2.fp.vip.bf1.yahoo.com.http > 10.28.98.4.51573: . 162061:163521(1460) ack 19 win 23
		16:59:47.611502 IP 10.28.98.4.51573 > ir2.fp.vip.bf1.yahoo.com.http: . ack 163521 win 1230
		16:59:47.612116 IP ir2.fp.vip.bf1.yahoo.com.http > 10.28.98.4.51573: . 163521:164981(1460) ack 19 win 23
		16:59:47.612124 IP ir2.fp.vip.bf1.yahoo.com.http > 10.28.98.4.51573: . 164981:166441(1460) ack 19 win 23
		16:59:47.612129 IP 10.28.98.4.51573 > ir2.fp.vip.bf1.yahoo.com.http: . ack 166441 win 1273
		16:59:47.612140 IP ir2.fp.vip.bf1.yahoo.com.http > 10.28.98.4.51573: . 166441:167901(1460) ack 19 win 23
		16:59:47.612403 IP ir2.fp.vip.bf1.yahoo.com.http > 10.28.98.4.51573: . 167901:169361(1460) ack 19 win 23
		16:59:47.612412 IP 10.28.98.4.51573 > ir2.fp.vip.bf1.yahoo.com.http: . ack 169361 win 1278
		16:59:47.612417 IP ir2.fp.vip.bf1.yahoo.com.http > 10.28.98.4.51573: . 169361:170821(1460) ack 19 win 23
		16:59:47.612420 IP ir2.fp.vip.bf1.yahoo.com.http > 10.28.98.4.51573: . 170821:172281(1460) ack 19 win 23
		16:59:47.612475 IP 10.28.98.4.51573 > ir2.fp.vip.bf1.yahoo.com.http: . ack 172281 win 1278
		16:59:47.612635 IP ir2.fp.vip.bf1.yahoo.com.http > 10.28.98.4.51573: . 172281:173741(1460) ack 19 win 23
		16:59:47.613279 IP ir2.fp.vip.bf1.yahoo.com.http > 10.28.98.4.51573: . 173741:175201(1460) ack 19 win 23
		16:59:47.613289 IP 10.28.98.4.51573 > ir2.fp.vip.bf1.yahoo.com.http: . ack 175201 win 1278
		16:59:47.613294 IP ir2.fp.vip.bf1.yahoo.com.http > 10.28.98.4.51573: . 175201:176661(1460) ack 19 win 23
		16:59:47.641582 IP ir2.fp.vip.bf1.yahoo.com.http > 10.28.98.4.51573: . 176661:178121(1460) ack 19 win 23
		16:59:47.641590 IP 10.28.98.4.51573 > ir2.fp.vip.bf1.yahoo.com.http: . ack 178121 win 1324
		16:59:47.641630 IP ir2.fp.vip.bf1.yahoo.com.http > 10.28.98.4.51573: . 178121:179581(1460) ack 19 win 23
		16:59:47.641638 IP 10.28.98.4.51573 > ir2.fp.vip.bf1.yahoo.com.http: . ack 179581 win 1369
		16:59:47.641841 IP ir2.fp.vip.bf1.yahoo.com.http > 10.28.98.4.51573: . 179581:181041(1460) ack 19 win 23
		16:59:47.641849 IP 10.28.98.4.51573 > ir2.fp.vip.bf1.yahoo.com.http: . ack 181041 win 1415
		16:59:47.641854 IP ir2.fp.vip.bf1.yahoo.com.http > 10.28.98.4.51573: . 181041:182501(1460) ack 19 win 23
		16:59:47.641858 IP 10.28.98.4.51573 > ir2.fp.vip.bf1.yahoo.com.http: . ack 182501 win 1460
		16:59:47.641860 IP ir2.fp.vip.bf1.yahoo.com.http > 10.28.98.4.51573: . 182501:183961(1460) ack 19 win 23
		16:59:47.641864 IP 10.28.98.4.51573 > ir2.fp.vip.bf1.yahoo.com.http: . ack 183961 win 1506
		16:59:47.641867 IP ir2.fp.vip.bf1.yahoo.com.http > 10.28.98.4.51573: . 183961:185421(1460) ack 19 win 23
		16:59:47.641871 IP 10.28.98.4.51573 > ir2.fp.vip.bf1.yahoo.com.http: . ack 185421 win 1552
		16:59:47.642344 IP ir2.fp.vip.bf1.yahoo.com.http > 10.28.98.4.51573: . 185421:186881(1460) ack 19 win 23
		16:59:47.642353 IP 10.28.98.4.51573 > ir2.fp.vip.bf1.yahoo.com.http: . ack 186881 win 1597
		16:59:47.642357 IP ir2.fp.vip.bf1.yahoo.com.http > 10.28.98.4.51573: P 186881:188341(1460) ack 19 win 23
		16:59:47.642361 IP 10.28.98.4.51573 > ir2.fp.vip.bf1.yahoo.com.http: . ack 188341 win 1643
		16:59:47.642363 IP ir2.fp.vip.bf1.yahoo.com.http > 10.28.98.4.51573: . 188341:189801(1460) ack 19 win 23
		16:59:47.642366 IP 10.28.98.4.51573 > ir2.fp.vip.bf1.yahoo.com.http: . ack 189801 win 1689
		16:59:47.642372 IP ir2.fp.vip.bf1.yahoo.com.http > 10.28.98.4.51573: . 189801:191261(1460) ack 19 win 23
		16:59:47.642376 IP 10.28.98.4.51573 > ir2.fp.vip.bf1.yahoo.com.http: . ack 191261 win 1734
		16:59:47.642403 IP ir2.fp.vip.bf1.yahoo.com.http > 10.28.98.4.51573: . 191261:192721(1460) ack 19 win 23
		16:59:47.642408 IP 10.28.98.4.51573 > ir2.fp.vip.bf1.yahoo.com.http: . ack 192721 win 1780
		16:59:47.642460 IP ir2.fp.vip.bf1.yahoo.com.http > 10.28.98.4.51573: . 192721:194181(1460) ack 19 win 23
		16:59:47.642467 IP 10.28.98.4.51573 > ir2.fp.vip.bf1.yahoo.com.http: . ack 194181 win 1825
		16:59:47.642492 IP ir2.fp.vip.bf1.yahoo.com.http > 10.28.98.4.51573: . 194181:195641(1460) ack 19 win 23
		16:59:47.642496 IP 10.28.98.4.51573 > ir2.fp.vip.bf1.yahoo.com.http: . ack 195641 win 1871
		16:59:47.642636 IP ir2.fp.vip.bf1.yahoo.com.http > 10.28.98.4.51573: . 195641:197101(1460) ack 19 win 23
		16:59:47.642643 IP 10.28.98.4.51573 > ir2.fp.vip.bf1.yahoo.com.http: . ack 197101 win 1917
		16:59:47.642646 IP ir2.fp.vip.bf1.yahoo.com.http > 10.28.98.4.51573: . 197101:198561(1460) ack 19 win 23
		16:59:47.642650 IP 10.28.98.4.51573 > ir2.fp.vip.bf1.yahoo.com.http: . ack 198561 win 1962
		16:59:47.642651 IP ir2.fp.vip.bf1.yahoo.com.http > 10.28.98.4.51573: . 198561:200021(1460) ack 19 win 23
		16:59:47.642655 IP 10.28.98.4.51573 > ir2.fp.vip.bf1.yahoo.com.http: . ack 200021 win 2008
		16:59:47.642678 IP ir2.fp.vip.bf1.yahoo.com.http > 10.28.98.4.51573: . 200021:201481(1460) ack 19 win 23
		16:59:47.642682 IP 10.28.98.4.51573 > ir2.fp.vip.bf1.yahoo.com.http: . ack 201481 win 2054
		16:59:47.642880 IP ir2.fp.vip.bf1.yahoo.com.http > 10.28.98.4.51573: . 201481:202941(1460) ack 19 win 23
		16:59:47.642888 IP 10.28.98.4.51573 > ir2.fp.vip.bf1.yahoo.com.http: . ack 202941 win 2099
		16:59:47.642893 IP ir2.fp.vip.bf1.yahoo.com.http > 10.28.98.4.51573: . 202941:204401(1460) ack 19 win 23
		16:59:47.642898 IP 10.28.98.4.51573 > ir2.fp.vip.bf1.yahoo.com.http: . ack 204401 win 2145
		16:59:47.642900 IP ir2.fp.vip.bf1.yahoo.com.http > 10.28.98.4.51573: . 204401:205861(1460) ack 19 win 23
		16:59:47.642903 IP 10.28.98.4.51573 > ir2.fp.vip.bf1.yahoo.com.http: . ack 205861 win 2190
		16:59:47.642906 IP ir2.fp.vip.bf1.yahoo.com.http > 10.28.98.4.51573: . 205861:207321(1460) ack 19 win 23
		16:59:47.642909 IP 10.28.98.4.51573 > ir2.fp.vip.bf1.yahoo.com.http: . ack 207321 win 2236
		16:59:47.642916 IP ir2.fp.vip.bf1.yahoo.com.http > 10.28.98.4.51573: . 207321:208781(1460) ack 19 win 23
		16:59:47.642919 IP 10.28.98.4.51573 > ir2.fp.vip.bf1.yahoo.com.http: . ack 208781 win 2282
		16:59:47.643118 IP ir2.fp.vip.bf1.yahoo.com.http > 10.28.98.4.51573: . 208781:210241(1460) ack 19 win 23
		16:59:47.643125 IP 10.28.98.4.51573 > ir2.fp.vip.bf1.yahoo.com.http: . ack 210241 win 2327
		16:59:47.643150 IP ir2.fp.vip.bf1.yahoo.com.http > 10.28.98.4.51573: . 210241:211701(1460) ack 19 win 23
		16:59:47.643155 IP 10.28.98.4.51573 > ir2.fp.vip.bf1.yahoo.com.http: . ack 211701 win 2373
		16:59:47.643223 IP ir2.fp.vip.bf1.yahoo.com.http > 10.28.98.4.51573: . 211701:213161(1460) ack 19 win 23
		16:59:47.643228 IP 10.28.98.4.51573 > ir2.fp.vip.bf1.yahoo.com.http: . ack 213161 win 2419
		16:59:47.643677 IP ir2.fp.vip.bf1.yahoo.com.http > 10.28.98.4.51573: . 213161:214621(1460) ack 19 win 23
		16:59:47.643686 IP 10.28.98.4.51573 > ir2.fp.vip.bf1.yahoo.com.http: . ack 214621 win 2464
		16:59:47.643690 IP ir2.fp.vip.bf1.yahoo.com.http > 10.28.98.4.51573: . 214621:216081(1460) ack 19 win 23
		16:59:47.643694 IP 10.28.98.4.51573 > ir2.fp.vip.bf1.yahoo.com.http: . ack 216081 win 2510
		16:59:47.643696 IP ir2.fp.vip.bf1.yahoo.com.http > 10.28.98.4.51573: P 216081:217541(1460) ack 19 win 23
		16:59:47.643699 IP 10.28.98.4.51573 > ir2.fp.vip.bf1.yahoo.com.http: . ack 217541 win 2555
		16:59:47.643701 IP ir2.fp.vip.bf1.yahoo.com.http > 10.28.98.4.51573: . 217541:219001(1460) ack 19 win 23
		16:59:47.643704 IP 10.28.98.4.51573 > ir2.fp.vip.bf1.yahoo.com.http: . ack 219001 win 2601
		16:59:47.643890 IP ir2.fp.vip.bf1.yahoo.com.http > 10.28.98.4.51573: . 219001:220461(1460) ack 19 win 23
		16:59:47.643898 IP 10.28.98.4.51573 > ir2.fp.vip.bf1.yahoo.com.http: . ack 220461 win 2647
		16:59:47.643937 IP ir2.fp.vip.bf1.yahoo.com.http > 10.28.98.4.51573: . 220461:221921(1460) ack 19 win 23
		16:59:47.643943 IP 10.28.98.4.51573 > ir2.fp.vip.bf1.yahoo.com.http: . ack 221921 win 2692
		16:59:47.645300 IP ir2.fp.vip.bf1.yahoo.com.http > 10.28.98.4.51573: . 221921:223381(1460) ack 19 win 23
		16:59:47.645309 IP 10.28.98.4.51573 > ir2.fp.vip.bf1.yahoo.com.http: . ack 223381 win 2738
		16:59:47.645315 IP ir2.fp.vip.bf1.yahoo.com.http > 10.28.98.4.51573: . 223381:224841(1460) ack 19 win 23
		16:59:47.645318 IP 10.28.98.4.51573 > ir2.fp.vip.bf1.yahoo.com.http: . ack 224841 win 2784
		16:59:47.645320 IP ir2.fp.vip.bf1.yahoo.com.http > 10.28.98.4.51573: FP 224841:225175(334) ack 19 win 23
		16:59:47.645646 IP 10.28.98.4.51573 > ir2.fp.vip.bf1.yahoo.com.http: F 19:19(0) ack 225176 win 2829
		16:59:47.677903 IP ir2.fp.vip.bf1.yahoo.com.http > 10.28.98.4.51573: . ack 20 win 23	
		
	- The following lines show the TCP connection establishment.
	
		16:58:30.916654 IP 10.28.98.4.51573 > ir2.fp.vip.bf1.yahoo.com.http: S 3400251960:3400251960(0) win 5840 <mss 1460,sackOK,timestamp 2888091 0,nop,wscale 6>
		16:58:30.948359 IP ir2.fp.vip.bf1.yahoo.com.http > 10.28.98.4.51573: S 1781654617:1781654617(0) ack 3400251961 win 8192 <mss 1460,nop,nop,sackOK,nop,wscale 8>
		16:58:30.948379 IP 10.28.98.4.51573 > ir2.fp.vip.bf1.yahoo.com.http: . ack 1 win 92
	
	- The following lines show the TCP connection termination.
	
		16:59:47.645320 IP ir2.fp.vip.bf1.yahoo.com.http > 10.28.98.4.51573: FP 224841:225175(334) ack 19 win 23
		16:59:47.645646 IP 10.28.98.4.51573 > ir2.fp.vip.bf1.yahoo.com.http: F 19:19(0) ack 225176 win 2829
		16:59:47.677903 IP ir2.fp.vip.bf1.yahoo.com.http > 10.28.98.4.51573: . ack 20 win 23

	3.2
	on your client host, run the following commands:
	telnet www.google.com 80
	GET / HTTP/1.0

	3.2.1
	On your client: Track down the packets in your tcpdump referring to the DNS query from your client host to your DNS server.

	[Solution]

		- Open a login session, run the following command to monitor DNS packages:

			[root@google ~]# tcpdump udp port 53
			tcpdump: verbose output suppressed, use -v or -vv for full protocol decode
			listening on eth0, link-type EN10MB (Ethernet), capture size 96 bytes
		
		- Open a new login session, run the 

			telnet www.google.com 80

		- Then the first login session, will capture the following packages:

			14:43:10.568687 IP 10.206.250.200.32909 > ec2-107-20-56-87.compute-1.amazonaws.com.domain: 63710+ AAAA? www.google.com. (32)
			14:43:10.569250 IP 10.206.250.200.32910 > ec2-107-20-56-87.compute-1.amazonaws.com.domain: 38389+ PTR? 87.56.20.107.in-addr.arpa. (43)
			14:43:10.587766 IP ec2-107-20-56-87.compute-1.amazonaws.com.domain > 10.206.250.200.32910: 38389 1/6/3 (328)
			14:43:10.587883 IP 10.206.250.200.32910 > ec2-107-20-56-87.compute-1.amazonaws.com.domain: 34062+ PTR? 200.250.206.10.in-addr.arpa. (45)
			14:43:10.588609 IP ec2-107-20-56-87.compute-1.amazonaws.com.domain > 10.206.250.200.32909: 63710 1/1/0 CNAME www.l.google.com. (102)
			14:43:10.588675 IP 10.206.250.200.32911 > ec2-107-20-56-87.compute-1.amazonaws.com.domain: 10275+ A? www.google.com. (32)
			14:43:10.593900 IP ec2-107-20-56-87.compute-1.amazonaws.com.domain > 10.206.250.200.32911: 10275 7/4/3 CNAME www.l.google.com.,[|domain]
			14:43:10.597351 IP ec2-107-20-56-87.compute-1.amazonaws.com.domain > 10.206.250.200.32910: 34062 NXDomain 0/1/0 (122)
	
	3.2.2
	On your DNS server: Track down the packets in your tcpdump referring to the DNS query from your DNS server to one of the root servers, then to the 
	various DNS servers before the DNS information is returned to your server by one of Google's authoritative DNS servers.
	
		- Open a login session, run the following command to monitor DNS packages:

